[
  {
    "id": "muscle_sternocleidomastoid",
    "slug": "sternocleidomastoid",
    "displayName": "Sternocleidomastoid",
    "anatomicalName": "Sternocleidomastoid",
    "entityType": "muscle",
    "contentStatus": "published",
    "confidence": "limited",
    "aliases": [],
    "regions": [
      "region_neck"
    ],
    "trainingGroups": [
      "group_neck"
    ],
    "parentIds": [],
    "childIds": [],
    "summary": "A paired muscle crossing the side of the neck, with sternal and clavicular heads.",
    "locationSummary": "Side of the neck, between the sternum/clavicle and skull.",
    "practicalImportance": "Use the sourced terminology to understand anatomy and movement context. Historical anatomy does not establish a training prescription, exact isolation, activation percentage or clinical treatment.",
    "structure": {
      "proximalAttachmentSummary": "Manubrium and medial clavicle.",
      "distalAttachmentSummary": "Mastoid process and lateral superior nuchal line."
    },
    "jointActions": [
      {
        "joint": "neck",
        "motion": "lateral flexion",
        "contributionLevel": "context-dependent",
        "qualifier": "One-sided action draws the head toward the same-side shoulder.",
        "sourceIds": [
          "gray_1918_remaining_anatomy"
        ]
      },
      {
        "joint": "neck",
        "motion": "contralateral rotation",
        "contributionLevel": "context-dependent",
        "qualifier": "One-sided action turns the face toward the opposite side.",
        "sourceIds": [
          "gray_1918_remaining_anatomy"
        ]
      },
      {
        "joint": "neck",
        "motion": "flexion",
        "contributionLevel": "context-dependent",
        "qualifier": "The source describes cervical flexion when both muscles act from their sternoclavicular attachments.",
        "sourceIds": [
          "gray_1918_remaining_anatomy"
        ]
      }
    ],
    "movementPatterns": [
      "flexion",
      "rotation"
    ],
    "relationships": [],
    "cautions": [
      "Qualitative historical anatomy from 1918; no modern training-effect or clinical review is claimed.",
      "No independent human review. Variation, modern biomechanical detail and unsourced subdivision-specific actions remain unavailable."
    ],
    "sources": [
      "gray_1918_remaining_anatomy"
    ],
    "reviewedBy": "Codex source verification; published_personal_use; no human review",
    "reviewedAt": "2026-10-07",
    "version": "1.0.0",
    "visibility": [
      "multiple"
    ]
  },
  {
    "id": "muscle_deltoid_middle",
    "slug": "middle-deltoid",
    "displayName": "Middle/lateral deltoid",
    "anatomicalName": "Middle/lateral deltoid",
    "entityType": "subdivision",
    "contentStatus": "published",
    "confidence": "limited",
    "aliases": [],
    "regions": [
      "region_shoulder"
    ],
    "trainingGroups": [
      "group_shoulders"
    ],
    "parentIds": [
      "muscle_deltoid"
    ],
    "childIds": [],
    "summary": "The central acromial portion of the deltoid, distinguished by its attachment and fiber arrangement.",
    "locationSummary": "Lateral shoulder, within the whole deltoid.",
    "practicalImportance": "Use the sourced terminology to understand anatomy and movement context. Historical anatomy does not establish a training prescription, exact isolation, activation percentage or clinical treatment.",
    "structure": {
      "proximalAttachmentSummary": "Acromion; the source distinguishes this central portion from clavicular and scapular-spine portions.",
      "distalAttachmentSummary": "Shared deltoid tendon reaching the lateral humeral prominence."
    },
    "jointActions": [],
    "movementPatterns": [],
    "relationships": [],
    "cautions": [
      "Qualitative historical anatomy from 1918; no modern training-effect or clinical review is claimed.",
      "No independent human review. Variation, modern biomechanical detail and unsourced subdivision-specific actions remain unavailable.",
      "Whole-muscle actions must not be interpreted as a measured head-specific action, activation ranking or isolation claim."
    ],
    "sources": [
      "gray_1918_remaining_anatomy"
    ],
    "reviewedBy": "Codex source verification; published_personal_use; no human review",
    "reviewedAt": "2026-10-07",
    "version": "1.0.0",
    "visibility": [
      "multiple"
    ]
  },
  {
    "id": "muscle_pectoralis_major_clavicular",
    "slug": "pectoralis-major-clavicular-portion",
    "displayName": "Pectoralis major — clavicular portion",
    "anatomicalName": "Pectoralis major — clavicular portion",
    "entityType": "subdivision",
    "contentStatus": "published",
    "confidence": "limited",
    "aliases": [],
    "regions": [
      "region_chest"
    ],
    "trainingGroups": [
      "group_chest"
    ],
    "parentIds": [
      "muscle_pectoralis_major"
    ],
    "childIds": [],
    "summary": "The clavicular portion of pectoralis major; the historical description distinguishes its origin and tendon contribution.",
    "locationSummary": "Upper anterior chest, within pectoralis major.",
    "practicalImportance": "Use the sourced terminology to understand anatomy and movement context. Historical anatomy does not establish a training prescription, exact isolation, activation percentage or clinical treatment.",
    "structure": {
      "proximalAttachmentSummary": "Anterior surface of the sternal half of the clavicle.",
      "distalAttachmentSummary": "Anterior lamina of the shared tendon at the crest of the greater tubercle of the humerus."
    },
    "jointActions": [],
    "movementPatterns": [],
    "relationships": [],
    "cautions": [
      "Qualitative historical anatomy from 1918; no modern training-effect or clinical review is claimed.",
      "No independent human review. Variation, modern biomechanical detail and unsourced subdivision-specific actions remain unavailable.",
      "Whole-muscle actions must not be interpreted as a measured head-specific action, activation ranking or isolation claim."
    ],
    "sources": [
      "gray_1918_remaining_anatomy"
    ],
    "reviewedBy": "Codex source verification; published_personal_use; no human review",
    "reviewedAt": "2026-10-07",
    "version": "1.0.0",
    "visibility": [
      "multiple"
    ]
  },
  {
    "id": "muscle_pectoralis_major_sternocostal",
    "slug": "pectoralis-major-sternocostal-portion",
    "displayName": "Pectoralis major — sternocostal portion",
    "anatomicalName": "Pectoralis major — sternocostal portion",
    "entityType": "subdivision",
    "contentStatus": "published",
    "confidence": "limited",
    "aliases": [],
    "regions": [
      "region_chest"
    ],
    "trainingGroups": [
      "group_chest"
    ],
    "parentIds": [
      "muscle_pectoralis_major"
    ],
    "childIds": [],
    "summary": "The sternal and costal portion of pectoralis major, with fibers converging into its shared humeral tendon.",
    "locationSummary": "Anterior chest, within pectoralis major.",
    "practicalImportance": "Use the sourced terminology to understand anatomy and movement context. Historical anatomy does not establish a training prescription, exact isolation, activation percentage or clinical treatment.",
    "structure": {
      "proximalAttachmentSummary": "Sternum and true-rib cartilages; the source describes variation in rib attachments.",
      "distalAttachmentSummary": "Shared tendon at the crest of the greater tubercle; much of the sternal and deep costal attachment enters its posterior lamina."
    },
    "jointActions": [],
    "movementPatterns": [],
    "relationships": [],
    "cautions": [
      "Qualitative historical anatomy from 1918; no modern training-effect or clinical review is claimed.",
      "No independent human review. Variation, modern biomechanical detail and unsourced subdivision-specific actions remain unavailable.",
      "Whole-muscle actions must not be interpreted as a measured head-specific action, activation ranking or isolation claim."
    ],
    "sources": [
      "gray_1918_remaining_anatomy"
    ],
    "reviewedBy": "Codex source verification; published_personal_use; no human review",
    "reviewedAt": "2026-10-07",
    "version": "1.0.0",
    "visibility": [
      "multiple"
    ]
  },
  {
    "id": "muscle_erector_spinae_group",
    "slug": "erector-spinae",
    "displayName": "Erector spinae group",
    "anatomicalName": "Erector spinae group",
    "entityType": "anatomical-group",
    "contentStatus": "published",
    "confidence": "limited",
    "aliases": [],
    "regions": [
      "region_lower_back"
    ],
    "trainingGroups": [
      "group_lower_back"
    ],
    "parentIds": [],
    "childIds": [],
    "summary": "The historical Sacrospinalis group divides into iliocostalis, longissimus and spinalis columns along the back.",
    "locationSummary": "Longitudinal columns beside the vertebral column.",
    "practicalImportance": "Use the sourced terminology to understand anatomy and movement context. Historical anatomy does not establish a training prescription, exact isolation, activation percentage or clinical treatment.",
    "structure": {
      "proximalAttachmentSummary": "Broad sacral, lumbar and iliac tendon; individual column attachments differ.",
      "distalAttachmentSummary": "Multiple vertebral and rib attachments, with upward continuations described separately."
    },
    "jointActions": [
      {
        "joint": "spine",
        "motion": "extension",
        "contributionLevel": "context-dependent",
        "qualifier": "The source describes maintaining an erect column and bending the trunk backward; individual columns and regions differ.",
        "sourceIds": [
          "gray_1918_remaining_anatomy"
        ]
      }
    ],
    "movementPatterns": [
      "extension"
    ],
    "relationships": [],
    "cautions": [